{
  "$schema": "https://json-schema.org/draft/2020-12/schema",
  "type": "object",
  "required": ["type", "team", "dev"],
  "properties": {
    "type": { "type": "string" },
    "team": { "type": "string" },
    "monorepo": { "type": "boolean" },
    "infrastructureRepository": { "type": "string" },
    "dev": { "type": "object" },
    "prod": { "type": "object" }
  }
}
